{
  "effect_id": "astra_basic",
  "category": "projectile",
  "layer": 1,
  "max_instances": 80,
  "event_type": "actual_projectile",
  "parameters": {
    "skill_id": "skill.astra.basic",
    "color": "#91e8ef",
    "style": "orb",
    "geometry": "runtime snapshot",
    "prototype": true,
    "renderer": "pixel_v3",
    "revision": "astra-pixel-v3",
    "art_status": "OWNER_REVIEW_PENDING"
  }
}
