{
  "effect_id": "vex_basic",
  "category": "projectile",
  "layer": 1,
  "max_instances": 80,
  "event_type": "actual_projectile",
  "parameters": {
    "skill_id": "skill.vex.basic",
    "color": "#efcf8f",
    "style": "bullet",
    "geometry": "runtime snapshot",
    "prototype": true,
    "renderer": "pixel_v3",
    "revision": "three-heroes-v3"
  }
}
