{
  "effect_id": "boros_j",
  "category": "area",
  "layer": 1,
  "max_instances": 80,
  "event_type": "confirmed_execution",
  "parameters": {
    "skill_id": "skill.boros.j",
    "color": "#be4e50",
    "style": "slam",
    "geometry": "runtime snapshot",
    "prototype": true,
    "renderer": "pixel_v3",
    "revision": "three-heroes-v3"
  }
}
